{
  "schema_version": "0.1",
  "generated_at": "2026-09-15T17:43:28Z",
  "git_sha": "a50dc4a505a489af09e2280862be2155db26d9d7",
  "run_id": "35002662861",
  "attestations": {
    "aci-gateway": [
      {
        "provider": "aci-gateway",
        "model": "tee.redpill.ai",
        "valid": true,
        "verified_at": "2026-09-15T17:43:30Z",
        "attestation_type": "aci-gateway",
        "signing_address": "",
        "signing_public_key": "",
        "signing_algo": "ecdsa",
        "scorecard": {
          "nonce_bound": true,
          "tdx_verified": true,
          "report_data_binds_key": true,
          "gpu_attested": null,
          "key_derives_to_address": null,
          "compose_hash_committed": true,
          "prod_os_image": true,
          "serving_code_attested": null,
          "backend_attested": false,
          "catalog_serves": true,
          "code_measurement_reproducible": null,
          "tls_pubkey_pinned": null,
          "hpke_pubkey_attested": null,
          "client_nonce_supported": null,
          "runtime_config_fully_attested": null,
          "attested_serving_enforced": true
        },
        "details": {
          "workload_keyset_digest": "sha256:9223dbe01170f56efeae9a72b0df74eeb3b30befecb3ec24d9c11413d1a25510",
          "os_image": "dstack-0.5.9-bd369a8c",
          "compose_hash": "1a23b6cc9d265648b3feb11a2a23453e84cf847953fb406b4b4bfd368083567c",
          "repo_commit": "3e56bd30dd459d0df90afeb6d63eca7a919bc22f",
          "tee_only_domains": [
            "tee.redpill.ai",
            "inference.phala.com"
          ],
          "models": 26,
          "sessions": "202/340 with evidence; missing: {'private-ai-verifier/chutes/v1': 138}",
          "tcb_status": null
        },
        "error": null,
        "latency_s": 0.0
      },
      {
        "provider": "aci-gateway",
        "model": "inference.phala.com",
        "valid": true,
        "verified_at": "2026-09-15T17:43:32Z",
        "attestation_type": "aci-gateway",
        "signing_address": "",
        "signing_public_key": "",
        "signing_algo": "ecdsa",
        "scorecard": {
          "nonce_bound": true,
          "tdx_verified": true,
          "report_data_binds_key": true,
          "gpu_attested": null,
          "key_derives_to_address": null,
          "compose_hash_committed": true,
          "prod_os_image": true,
          "serving_code_attested": null,
          "backend_attested": false,
          "catalog_serves": true,
          "code_measurement_reproducible": null,
          "tls_pubkey_pinned": null,
          "hpke_pubkey_attested": null,
          "client_nonce_supported": null,
          "runtime_config_fully_attested": null,
          "attested_serving_enforced": true
        },
        "details": {
          "workload_keyset_digest": "sha256:9223dbe01170f56efeae9a72b0df74eeb3b30befecb3ec24d9c11413d1a25510",
          "os_image": "dstack-0.5.9-bd369a8c",
          "compose_hash": "1a23b6cc9d265648b3feb11a2a23453e84cf847953fb406b4b4bfd368083567c",
          "repo_commit": "3e56bd30dd459d0df90afeb6d63eca7a919bc22f",
          "tee_only_domains": [
            "tee.redpill.ai",
            "inference.phala.com"
          ],
          "models": 26,
          "sessions": "201/339 with evidence; missing: {'private-ai-verifier/chutes/v1': 138}",
          "tcb_status": null
        },
        "error": null,
        "latency_s": 0.0
      },
      {
        "provider": "aci-gateway",
        "model": "api.redpill.ai",
        "valid": false,
        "verified_at": "2026-09-15T17:43:30Z",
        "attestation_type": "aci-gateway",
        "signing_address": "",
        "signing_public_key": "",
        "signing_algo": "ecdsa",
        "scorecard": {
          "nonce_bound": true,
          "tdx_verified": true,
          "report_data_binds_key": true,
          "gpu_attested": null,
          "key_derives_to_address": null,
          "compose_hash_committed": true,
          "prod_os_image": true,
          "serving_code_attested": null,
          "backend_attested": false,
          "catalog_serves": true,
          "code_measurement_reproducible": null,
          "tls_pubkey_pinned": null,
          "hpke_pubkey_attested": null,
          "client_nonce_supported": null,
          "runtime_config_fully_attested": null,
          "attested_serving_enforced": false
        },
        "details": {
          "workload_keyset_digest": "sha256:9223dbe01170f56efeae9a72b0df74eeb3b30befecb3ec24d9c11413d1a25510",
          "os_image": "dstack-0.5.9-bd369a8c",
          "compose_hash": "1a23b6cc9d265648b3feb11a2a23453e84cf847953fb406b4b4bfd368083567c",
          "repo_commit": "3e56bd30dd459d0df90afeb6d63eca7a919bc22f",
          "tee_only_domains": [
            "tee.redpill.ai",
            "inference.phala.com"
          ],
          "models": 71,
          "sessions": "202/340 with evidence; missing: {'private-ai-verifier/chutes/v1': 138}",
          "tcb_status": null
        },
        "error": null,
        "latency_s": 0.0
      }
    ],
    "near-ai": [
      {
        "provider": "near-ai",
        "model": "openai/gpt-oss-120b",
        "valid": false,
        "verified_at": "2026-09-15T17:43:32Z",
        "attestation_type": "tdx+gpu",
        "signing_address": "",
        "signing_public_key": "",
        "signing_algo": "ecdsa",
        "scorecard": {
          "nonce_bound": null,
          "tdx_verified": null,
          "report_data_binds_key": null,
          "gpu_attested": null,
          "key_derives_to_address": null,
          "compose_hash_committed": null,
          "prod_os_image": null,
          "serving_code_attested": null,
          "backend_attested": null,
          "catalog_serves": null,
          "code_measurement_reproducible": null,
          "tls_pubkey_pinned": null,
          "hpke_pubkey_attested": null,
          "client_nonce_supported": null,
          "runtime_config_fully_attested": null,
          "attested_serving_enforced": null
        },
        "details": {},
        "error": "HTTP 503: {\"error\":{\"message\":\"Provider error: Model 'openai/gpt-oss-120b' not found. It's not a valid model name or alias.\",\"type\":\"provider_error\",\"param\":null,\"code\":null}}",
        "latency_s": 0.26
      },
      {
        "provider": "near-ai",
        "model": "zai-org/GLM-5.1-FP8",
        "valid": true,
        "verified_at": "2026-09-15T17:43:35Z",
        "attestation_type": "tdx+gpu",
        "signing_address": "0x3b753b4406613c5e70ae640508632b600424fa0c",
        "signing_public_key": "42d42e51842e50841e08b096b62cdaf52786c7ce0b04577bb476cef327d42d8db9cc9dd35c9738bf7769e2b33d51c0a2d9aa01e85da0507ddb4e875a2b5bdfd1",
        "signing_algo": "ecdsa",
        "scorecard": {
          "nonce_bound": true,
          "tdx_verified": true,
          "report_data_binds_key": true,
          "gpu_attested": true,
          "key_derives_to_address": true,
          "compose_hash_committed": true,
          "prod_os_image": null,
          "serving_code_attested": null,
          "backend_attested": false,
          "catalog_serves": null,
          "code_measurement_reproducible": null,
          "tls_pubkey_pinned": null,
          "hpke_pubkey_attested": null,
          "client_nonce_supported": null,
          "runtime_config_fully_attested": null,
          "attested_serving_enforced": null
        },
        "details": {
          "inner_models": 1,
          "gpu_verdict": true,
          "gateway_compose_hash": "ce035ad5096278936c22bbafed944d467c781bc76a2fd387db9ccdafad924caf",
          "cloud_api_image_digest": "15d734ea567adaeda8d26188d89d7eb5ef2585d792e35672b341e1ea70829d6c",
          "gateway_self_consistent": true,
          "chain_authorized": false,
          "audit_key": null
        },
        "error": null,
        "latency_s": 2.81
      }
    ],
    "tinfoil": [
      {
        "provider": "tinfoil",
        "model": "router",
        "valid": true,
        "verified_at": "2026-09-15T17:43:36Z",
        "attestation_type": "tinfoil-sev-snp-v2",
        "signing_address": "",
        "signing_public_key": "4f7692c1538e51235a87020f8c09cf6e0123a1bc3c14dc8041a9c1882ebb7115",
        "signing_algo": "hpke",
        "scorecard": {
          "nonce_bound": null,
          "tdx_verified": null,
          "report_data_binds_key": null,
          "gpu_attested": null,
          "key_derives_to_address": null,
          "compose_hash_committed": null,
          "prod_os_image": null,
          "serving_code_attested": null,
          "backend_attested": null,
          "catalog_serves": null,
          "code_measurement_reproducible": true,
          "tls_pubkey_pinned": true,
          "hpke_pubkey_attested": true,
          "client_nonce_supported": false,
          "runtime_config_fully_attested": false,
          "attested_serving_enforced": null
        },
        "details": {
          "domain": "inference.tinfoil.sh",
          "digest": "3b17a271d98c4f2ba560af7ea686cde9539d7a36ef7c75d17f0f4538b59acd62",
          "predicate": "https://tinfoil.sh/predicate/sev-snp-guest/v2",
          "repo": "tinfoilsh/confidential-model-router",
          "digest_audited": false,
          "sev": {
            "version": 3,
            "policy_hex": "0x30000",
            "debug": false,
            "vmpl": 0,
            "measurement": "44c671aff413ed697a28ee234429f2fb00977865c54f1469edfe8c698d017a6a547f728ce137f3b3c0c8142a367520a7",
            "report_data": "305b0cafe5533f8276b7d3a94cb7c3ebf72d971386239eed70d5dfa8d1c775674f7692c1538e51235a87020f8c09cf6e0123a1bc3c14dc8041a9c1882ebb7115"
          },
          "sigstore_predicate_type": "https://tinfoil.sh/predicate/snp-tdx-multiplatform/v1",
          "sigstore_measurement": "44c671aff413ed697a28ee234429f2fb00977865c54f1469edfe8c698d017a6a547f728ce137f3b3c0c8142a367520a7",
          "attested_config": {
            "cvm_version": "0.11.0",
            "container_count": 1,